<?xml version="1.0" encoding="UTF-8"?>
<TIPPManifest xmlns:xsi="http://www.w3.org/2001/XMLSchema-instance"
    xmlns:ds="http://www.w3.org/2000/09/xmldsig#"
    xsi:noNamespaceSchemaLocation="http://schema.interoperability-now.org/tipp/TIPPManifest-1_5.xsd" 
    version="1.5">
  <GlobalDescriptor>
    <UniquePackageID>urn:uuid:12345-abc-6789-aslkjd-19193la-as9911</UniquePackageID>
    <Creator>
      <Name>Test Company</Name>
      <ID>http://127.0.0.1/test</ID>
      <Date>2011-05-09T22:45:00Z</Date>
      <Tool>
        <ToolName>TestTool</ToolName>
        <ToolID>http://interoperability-now.org/</ToolID>
        <ToolVersion>1.0</ToolVersion>
      </Tool>
    </Creator>
    <!-- No dsig in this file, for simplicity -->
  </GlobalDescriptor>
  <TaskRequest>
    <TaskType>http://schema.interoperability-now.org/tipp/v1.5/tasks/translate-strict-bitext</TaskType>
    <SourceLanguage>en-US</SourceLanguage>
    <TargetLanguage>fr-FR</TargetLanguage>
  </TaskRequest>
  <Resources>
    <Bilingual name="bilingual">
      <FileResource sequence="1">
        <Name>Peanut_Butter.xlf</Name>
        <Location>Peanut_Butter.xlf</Location>
      </FileResource>
    </Bilingual>
    <Reference name="reference">
      <ReferenceFileResource sequence="1" languageChoice="Source">
        <Location>Sample.pdf</Location>
        <Description>Source Language PDF</Description>
      </ReferenceFileResource>
      <ReferenceFileResource sequence="2" languageChoice="Bilingual">
        <Location>PreviousTranslation.xlf</Location>
        <Description>Previous translation (XLIFF:doc format)</Description>
      </ReferenceFileResource>
      <ReferenceFileResource sequence="3">
        <Location>Style.pdf</Location>
        <Description>Style guide.</Description>
      </ReferenceFileResource>
    </Reference>
    <Preview name="preview">
      <FileResource sequence="1">
        <Location>Peanut_Butter.html.skl</Location>
      </FileResource>
      <FileResource sequence="2">
        <Location>resources/20px-Padlock-silver.svg.png</Location>
      </FileResource>
      <FileResource sequence="3">
        <Location>resources/load.php</Location>
      </FileResource>
      <FileResource sequence="4">
        <Location>resources/290px-PeanutButter.jpg</Location>
      </FileResource>
      <FileResource sequence="5">
        <Location>resources/load(1).php</Location>
      </FileResource>
      <FileResource sequence="6">
        <Location>resources/magnify-clip.png</Location>
      </FileResource>
    </Preview>
  </Resources>
</TIPPManifest>
